<?xml version="1.0" encoding="UTF-8"?>
<!-- edited with XMLSpy v2005 rel. 3 U (http://www.altova.com) by  () -->
<!--Sample XML file generated by XMLSpy v2005 rel. 3 U (http://www.altova.com)-->
<PermDef xmlns:xsi="http://www.w3.org/2001/XMLSchema-instance" xsi:noNamespaceSchemaLocation="PermDef.xsd" NameSpace="FEP离线">
	<ObjTypeDef>
		<ObjType Name="FEP节点" CreatDate="2010-04-16" Des="工程中一个FEP节点对应的逻辑实体" Creater="张玉国">
			<InputObjName/>
		</ObjType>
	</ObjTypeDef>
	<OprDef>
		<Operation Name="编辑" CreatDate="2010-04-16" Des="FEP内所涵盖逻辑实体的编辑操作" Creater="张玉国">
			<ObjTypeRef>
				<AllType/>
			</ObjTypeRef>
		</Operation>
	</OprDef>
</PermDef>
