<?xml version="1.0" encoding="UTF-8"?>
<!-- edited with XMLSpy v2005 rel. 3 U (http://www.altova.com) by  () -->
<!--Sample XML file generated by XMLSpy v2005 rel. 3 U (http://www.altova.com)-->
<PermDef xmlns:xsi="http://www.w3.org/2001/XMLSchema-instance" xsi:noNamespaceSchemaLocation="PermDef.xsd" NameSpace="对象库在线">
	<ObjTypeDef>
		<ObjType Name="数据库单元" CreatDate="2006-12-19" Des="数据库单元，包括对象库和历史库等" Creater="谢文虎">
			<InputObjName/>
		</ObjType>
		<ObjType Name="对象" CreatDate="2006-12-19" Des="数据库对象，即点，包括容器对象、子对象" Creater="谢文虎">
			<InputObjName/>
		</ObjType>
		<ObjType Name="模板" CreatDate="2006-12-29" Des="数据库模板" Creater="谢文虎">
			<InputObjName/>
		</ObjType>
	</ObjTypeDef>
	<OprDef>
		<Operation Name="读写" CreatDate="2006-12-19" Des="读写数据库单元、对象或模板" Creater="谢文虎">
			<ObjTypeRef>
				<AllType/>
			</ObjTypeRef>
		</Operation>
	</OprDef>
</PermDef>
